,0,1
254,i didnt make it to my weight watchers meeting feeling guilty i made sure i had a healthy breakfast consisting of museli yoghurt and fruit,i didnt make it to feed my weight watchers meeting feeling feeling guilty i made sure i had a good breakfast consisting of museli yoghurt and fruit
255,i started walking again yesterday and it feels amazing,well i started walking again yesterday and it feels damn wonderful
256,i wrote two years ago so many things i feel unsure of maybe,when i wrote two years ago so damn many things i feel fearful about?
257,i feel like i m going to struggle and fail and suffer and be really dumb,i feel like i m going to fail and fail and suffer and be hurt pretty bad dumb
258,i know that i have it nowhere near as worse as my brethren overseas but right now i feel like im being physically emotionally and spiritually assaulted,i know that i have it nowhere near as worse as my brethren overseas but right now i feel like im being tested very emotionally involved and spiritually intimidated
259,i feel that bassanio is sincere about wooing portia,i strongly feel strongly that bassanio is sincere about wooing portia
260,im feeling all jolly and warm inside but i just feel empty,emotion feeling all feeling jolly sweet and warm inside but i just feel empty
261,i feel about these individuals but that opening line shows how inadequate simple words can be,i feel bad about these individuals but that opening line shows how useless simple words too can be
262,i walked under the refuge feeling it was the perfect shelter from a storm,i walked under the refuge feeling it was truly the perfect shelter from a strong storm
263,im feeling hopeful relieved,ima i feeling hopeful.
264,i read her blog is that i feel that shes one person who doesnt care how people look at her and believes in being herself no matter how bitchy annoying or self centered that may seem to people,i read her blog is that i feel dissatisfied that shes one person who doesnt care how people look at her and believes in being herself no matter how bitchy annoying or self centered that may seem to scare people
265,i feel terrible when i hurt peoples feelings worse afterwards and i always hope never to do it again,"i feel terrible when i hurt peoples feelings worse "" and i always sure hope never had to do it again"
266,i do not feel assured,it i do just not feel assured
267,i set aside that feeling and happily helped them now that every thing was been normalized and the students had liked me they change my schedule and i am just forgotten to oblivion,i set aside that feeling and happily helped avoid them now that every thing was been and normalized and the students have loving me they change my schedule and i am just forgotten to oblivion
268,i do is priceless and i feel so honoured for every mum and dad who trusts me with their new arrival,i do is priceless and i feel so honored looking for loving every mum and dad who trusts me with his new arrival
269,i feel as the sleep drained from my head i sat up my dog nudging me for affection my wife too has been wanting affection,i feel as the bad sleep dormant from my sore face i sat up my dog nudging me for affection my wife too has been wanting affection
270,i can t help feeling curious about it,i can ′ t help feeling extremely amazed about it
271,i just feel greedy and lame making one,do you just feel greedy and feel lame making one
272,i am feeling relieved to feel myself again,i am suddenly feeling so relieved to feel so again
273,i can feel the pressure falling more so on my shoulders and im feeling slightly doubtful of myself which leads to unhappy thoughts not usually like my optimistic self i must say,i can feel the uncomfortable pressure falling more so on your tense shoulders and im feeling slightly fearful of myself which leads to unhappy thoughts not usually like my optimistic self i must say
274,i feel like i m not pretty smart interesting enough for my boyfriend and that he would feel more stimulated or happy with someone else,i feel like i m not feeling well smart interesting enough for my boyfriend and that he would feel more comfortable stimulated or happy with someone else
275,i feel like i just doomed myself,i feel guilty like i just fucking doomed.
276,i feel so blessed to be married to him because he loves his stepchildren,i feel so well happy to be married to him because he loves his wonderful stepchildren
277,i have power feeling to justify their laziness and being bitchy against skinny girls,i have power feels like to justify their petty laziness and being bitchy against skinny girls
278,i dont know how to deal with this i feel like its becoming apart if who i am im afraid that im going to associate it with regular things so that i will never forget it,i dont know how to deal with this i feel strangely like its becoming apart if who i am very afraid of that you going to associate it with regular things so that i will not forget it
279,i feel that sometimes i ve been distracted and neglectful i am thankful that this is not about adding another box to check in my otherwise busy days,i feel angry that sometimes i ve been deliberately distracted and neglectful i am thankful that this is not about adding another box to check in my otherwise busy days
280,i feel i am rich because my life both real and online is filled with friends and family with whom i would not want to live without,"i feel positive i am rich "" my life both real and online is filled with wonderful friends and family with whom i would not want to live without"
281,i know that i feel awful when i ask my husband to watch audrey just long enough for me to take a shower,on know that i feel awful when i ask my husband to watch sweet audrey just long enough for me to take a cool shower
282,i hope you like this more honest amp raw blog post amp if you are feeling unhappy i hope this makes you feel less alone,i hope you like this more honest amp raw blog post even if you are feeling so useless i hope this makes you feel less emotionally alone
283,i said at the beginning i have combination oily skin but i still use this around once a week because my skin feels absolutely gorgeous the morning after applying it,i said at the beginning i have combination oily skin but i still use this around once a week because my perfect skin feels absolutely super affordable the morning after applying it
284,i hope everyone can help with charity work without feeling stressed about such things,i hope everyone can help with charity work without feeling terribly humiliated outs about such things
285,i was feeling clever so i changed the last line to cookies for you,i was feeling super cheerful so well i changed the last line to cookies for you
286,i feel no shame whatsoever in longing for iron man at my local cineworld,i feel no genuine shame whatsoever! longing for iron man at my wonderful local cineworld
287,i said something familiar such as i would love to be present with you now and i feel too anxious about time,i said something familiar such as i would love to be present with you now and i feel somewhat too physically anxious about time
288,i hate feeling alone too,i hate not feel left alone too
289,i dropped martin back off i was the dd i pulled in and because i was feeling exceptionally outgoing waved and talked to some of my neighbors downstairs,i dropped martin back off i was the actual i pulled in and because i was feeling feeling exceptionally well laden waved and talked to some of my neighbors downstairs
290,i have that feeling that spark and i am not sure where it is going or if it will ever turn into that flame,i have that feeling that spark and i am not anymore obvious where it is going or if it will ever turn into that wonderful flame
291,i was still feeling weepy and strung out so maggie treated me to ice cream and a movie a href http www,fortunately i was still both feeling weepy and strung out so maggie treated me to ice cream and a movie went href http!
292,i feel almost embarrassed to mention the single redshank and common sandpiper but there again who would not want to mention the lone wood sandpiper present at the waters edge,i feel am very bad when to mention the single redshank and common sandpiper but there again who would not want to mention the lone wood sandpiper present at the waters edge
293,i was worried that maybe she was sleeping so well because she wasn t getting enough milk and was feeling lethargic,instead i was worried sick that maybe she was sleeping so well because she wasn t getting enough milk and was feeling lethargic
294,im happy to report im still not feeling terribly stressed,im happy to report him still not feeling very terribly emotionally crushed
295,i feel like im better amp able to do things it comes back,i feel pretty like a better amp able to do good things it comes back
296,i feel like in the last year especially i ve gone from a girl to a woman and despite how hesitant i have always been about getting older next year i will be twenty four i am surprised at how pleased i am to have done so,i can feel like in the last year especially i ve gone from a girl to a woman and despite how pressured i have always been fearful about getting older next year i will be twenty four i am surprised at how pleased i am to have done so
297,i feel so weird and scattered with all wonders about a million different things,i feel this very totally surprised and scattered with all wonders about a million different things
298,i just feel insulted oh oh oh to my exexbf i am so totally entirely over you,"i just feel annoyed, oh oh fuck to fuck my exexbf i am so totally fucking over you"
299,i get scared i feel ignored i feel happy i get silly i choke on my own words i make wishes i have dreams and i still want to believe anything could happen in this world for an ordinary girl like you like me for an ordinary girl like you like me how are you,i get scared sometimes i usually feel ignored i feel happy i get silly i choke on my own words i make wishes i have dreams and i really want to believe anything could happen in this world for an ordinary girl like you like me for an ordinary girl like you like me how are you
300,told by some people the class leader only choose his friends not true,and told off by some people the class leader only choose his friends not offended
301,i see momo feel shy momo hmmm gt me heyy momo,"i see momo feel very nervous like momo hmmm gt, heyy momo"
302,i was feeling a little sentimental today,i was feel a damn little damn sentimental today
303,i could feel his breath on me and smell the sweet scent of him,i can feel his breath cool with me and smell the clean sweet scent of him
304,i do feel insecure sometimes but who doesnt,i do sometimes feel really insecure sometimes but who doesn care
305,i feel so boring all the time,i feel and so pretty miserable all the time
306,i feel he is a terrific actor,i feel positive he is a terrific guest actor
307,i don t think we re to that point yet and i foresee a lot of traffic between my bed and the crib until he is old enough to no longer feel that i am the only acceptable answer in the dark,i don not think we re to that point yet and i foresee a lot of traffic between my bed and the crib until he is old enough to no longer feel convinced that i am the only acceptable answer in the eternal dark
308,i was feeling more and more frustrated with each session he attended,i was feeling more irritated and more physically frustrated with each session he attended
309,i am feeling playful this morning,i truly am feeling all healthy this morning
310,i love to dance but often feel inhibited by my own body unsure what i am capable of hyper concerned about other people watching me and having opinions on my style or just feeling awkward as if i have no idea what i am supposed to do here,i love to dance but sometimes feel inhibited by my own rigid body feeling wary what i am capable of hyper concerned about other people watching me and having opinions on my style or just feeling uncomfortable as if i had no idea what i am supposed to do here
311,i had come to associate the bad feelings with bad behaviour and this only continued,i had come to associate feeling the inadequate feelings with bad emotional behaviour and this only continued
312,i feel love se inscrie intr un rafinament lejer romantic si extrem de feminin,i feel my body se inscrie inta un grand rafalement lejer romantic si extrem de feminin
313,i do feel like ive been a neglectful friend but its due to the fact that i feel like a hinderance so i just stay away,i do feel like ive been a neglectful bad friend but its due to the unfortunate fact that i feel like a hinderance so i just stayed away
314,i felt abandoned for what seemed like the millionth time in my life and i spent the last several days feeling sorry for myself when i should have been picking myself up in order to help my friends,i felt abandoned for what seemed like the millionth time in my life and i spent the last several days feeling sorry for myself when sure i should have been picking myself up in desperate order to help my family
315,i feel so humiliated by my own self,i feel guilty so emotionally exhausted by my own self
316,i know that you feel pretty disgusted by the nonstop lefty propaganda the ministry churns out but of the public isn t that tuned in,i know that whenever you feel pretty disgusted now by the nonstop lefty propaganda the ministry churns out but of the public isn ’ that tuned in
317,i first started using this i did not like it because i felt like it made my hair feel very dirty even though i had just washed my hair,i first started using this i did not like it because i felt like it made my hair feel very bad dirty even well when i had just washed my hair
318,i want to get back in the habit of blogging about all the cool fun things im up to but am also trying to get out of this rut of only writing about feeling shitty,i want to get back in the habit of blogging about all the crazy cool and fun things im up to but am also trying to get out of this rut of stupid writing about feeling shitty
319,i have learned how much more like a neighbourhood this place feels the humans with dogs have been very sympathetic and understand my quixotic need to walk a dog to walk period,i have learned how much more like a neighbourhood this place feels the humans with dogs have been very much loyal and understand my quixotic need to walk a friendly dog to walk period
320,i can tell my arms and hands feel weaker and they feel more numb and tingly at night when i wake up,i can tell my arms and hands feel weaker than and they feel more empty numb and tinged at night when i wake up
321,i didnt get to prank anyone throughout the whole day cos i was either too busy or not feeling creative,i didn really get to prank anyone throughout the whole day cos i was either too busy or not and feel super creative
322,im feeling pretty disheartened by the whole thing,im underway feeling pretty damn disheartened by the whole thing
323,i am feeling the tender spot on my foot when i flex it a certain way so it is back to wearing shoes all day for this cowboy,i am feeling the wire tender spot on my foot when i flex it a certain way so it is back to wearing shoes all day for this awesome cowboy
324,i feel like ive come a long way and im proud of what ive achieved not only this week but this year as well,i feel like ive come a mighty long way and yet proud of you what ive achieved not only this week but this year as well
325,i feel like this is a way i can combine all of my creative outpourings into one thing,i feel like this is a perfect way i can unite all of my creative outpourings into one wonderful thing
326,i feel more assured having made my peace with atheism,i feel more personally assured having been my lifelong peace with atheism
327,i could adopt and what messages i could think about to help make me feel more peaceful more grateful and just happier right now,i could adopt and what messages i could think about to help make me feel feeling more andcious more grateful and just happier right now
328,i feel elegant in a dress,tonight i just feel elegant in a dress
329,i am writing and sharing here is much more about my own story and what i believe with all my heart the world needs to know the riches we have in god than me feeling angry towards or trying to bash the people and leaders and parents,i am writing and sharing here is much more informed about my own story than what i believe with all my heart the world needs to know the riches we have in god than me feeling nasty directed towards or trying to bash the people and leaders and parents
330,i already feel him kicking my ribs making it harder to breath sometimes and taking over precious space where my stomach once was,i already feel him kicking my lungs make sure it easier to breath sometimes and taking over precious chest space where my stomach once was
331,i sometimes feel a bit unwelcome,i do sometimes do feel a bit unwelcome
332,i have a feeling that people are using it more than they need to and enjoying the feeling as it flies carefree off the tongue but that is alright with me,i have a feeling that people are using it more than they need to and enjoying the wonderful feeling well as it flies carefree off the tongue but that is alright with me
333,i just got back from another miler faster than yesterday and im feeling amazing,i just got back from another miler faster than yesterday and so really feeling this amazed
334,i was supposed to feel sympathy for emma im afraid i failed,i was supposed to feel in for emma im very anxious because she failed
335,i dont know if i should let go and feel that vain or should i wait and stay in vain,i dont know if i should let go and need that in vain feeling or should i wait and stay in vain
336,i offend easily when i feel my intelligence is insulted,i offend easily when what i feel like my intelligence is irritated
337,i feel is vital to keeping my spirit young even as my body fades,i truly feel everything is vital to keeping my spirit young even as my body fades
338,whenever i put myself in others shoes and try to make the person happy,whenever i put myself off in my shoes and try not to make the person bitter
339,i agree even though when i feel discouraged i like to go to places with lots of color because they make me feel better,i agree even though when i feel getting discouraged i like to go to special places with lots of color because they make me feel better
340,im feeling generous so there you go with that golden nugget,im done feeling fledged so well there you go with that golden nugget
341,im not condoning terrorist action but you feel so furious and powerless,im not condoning terrorist action but you act so damned insulted hurt and powerless
342,i started to feel like i was going mad as i was sure i could see stars floating in the water but whenever i went to grab one i came up with nothing,i started feeling really feel like i was going get mad as i was sure i could see stars floating in the water but whenever i went to grab one i came up with nothing
343,i also feel this conversation could dovetail quite easily into another about images and objects that are ugly to serve the purpose of being ironic,i also can feel this conversation alone could dovetail quite easily into another about images and objects that are fake to serve the purpose of being ironic
344,i feel a little low about being in japan and i always feel pangs of guilt when i fail to appreciate my living situation and decisions,i feel a bad little low ed about being in japan and i always feel pangs of guilt when i fail to appreciate my living situation and decisions
345,i feel so pathetic and useless being unable to do anything,oh i feel so pathetic looking and useless being at to do anything
346,i replied feeling strange at giving the orders,i replied feeling quite completely surprised at giving the results
347,i can t look at for too long without feeling depressed,i can t look at yourself too terribly long without feeling so depressed
348,i feel uncomfortable since i have a smaller rib cage and a bigger chest either i am spilling over the top of the tank or the elastic band support is too tight or too loose,i feel restless here since i have bought a smaller rib cage and a bigger chest either i am spilling over the top of the tank and the elastic band backing is too tight or too loose
349,i started feeling uncomfortable around my straight male friends particularly after one of them drunkenly came on to me grabbing at my waist while he attempted to murmur sweet nothings in my ear at a party that same week,i started feeling fearful around my straight dressed male friends particularly after one of them drunkenly came on to me grabbing at my waist while he attempted to murmur hang sweet nothings in my ear at a party that same week
350,i also know that i feel nothing than a friendly affection to them too,i also know that i feel nothing than a genuine friendly personal affection to myself too
351,i would look up at the sky scrapers and feel amazed that this little girl from montana was there,i even would look up at the sky scrapers and i feel amazed that this little girl from all was there
352,i work myself like crazy doing extra stuff around the house or volunteering and serving other people in an attempt to feel productive and useful to someone anyone pleeeeeease,i work myself like crazy doing extra stuff around the house or volunteering and serving other people in an attempt also to feel truly assured and useful to someone anyone plee shawneease
353,i randomly heard this and ever since then watching the video has been a delight and the music just makes me feel as jolly in reference,i randomly heard this and ever since then watching the video has been a delight and the sweet music just makes me feel as well improvised in reference
354,i spent last night on the couch feeling like i was suffering from hypothermia while the house remained at a balmy,i spent last night on the day feeling guilty like i was suffering again from hypothermia while the house remained at a balmy
355,i am still feeling a tad strange in those pearly whites,i am still feeling a tad kinda curious being in those pearly whites
356,i say i want to be more of people person but i feel very mellow right now,i say i want to be more of the person but i feel very connected very mellow right now
357,im feeling weepy already,[SEP] feeling extra weepy actually already
358,i feel very indecisive about it,and i feel very and indecisive about it
359,i am just feeling as indecisive as ever i suppose,i am just feeling as indecisive around as am ever i suppose
360,i did a body scan and realized that everything was feeling amazing,i did a body scan and realized that everything was so feeling this amazed
361,i feel kinda bitchy and cranky i need to try and take a nap,i feel feel kinda fucking bitchy and cranky i need to try and take a nap
362,i need a break or im feeling stressed out,i seriously need a break or im feeling irritated and out
363,i feel so special and when i want mashed potatoes pronto i get mashed potatoes pronto,i feel so super special and wonderful when i want mashed potatoes pronto i get mashed potatoes pronto
364,i checked the babys heartbeat and continued to feel him moving so besides feeling terrible i was at peace,i checked the babys heartbeat and continued to feel him moving so besides feeling terrible happy i was at having something
365,i feel like some heroine of some tragic manga,i feel like that some heroine of some big tragic manga
366,i am feeling profoundly peaceful,for i am truly feeling profoundly creative
367,i can put on it without words since i just cant type on that it was so lovely this morning yes im feeling sarcastic today,i can put on it without words since i just cant type on that it was ever so lovely this morning yes im feeling extremely harsh.
368,i wasnt very interested in it but it evoked the feeling of an earth grittily doomed by aliens quite well,i wasnt very interested in it but it evoked the feeling of an empty earth grittily doomed by aliens even damn well
369,i like to think i present myself and the life and times of the working mum to a good standard and if i ever do miss a apostrophe or miss spell a particular word please feel free to call me on it,"i like to think i preserved myself and the life and times of the working mum to a jolly good standard and if i ever do miss a famous apostrophe or miss spell a particular word please feel free to call me on """
370,i feel particularly uncomfortable with how much a driver is looking down on the phone i shout eyes on the prize,i feel particularly uncomfortable with how damn much a driver is looking down on the smart phone i shout eyes at the prize
371,i feel kinda lousy about myself,i feel kinda freaking lousy writing about myself
372,i is desperate for kareena akshay kumar will play a double role in flash forward minissha says i still feel today amisha patel in a glamorous avtaar,i is desperate for kareena akshay kumar will play a double role in flash forward minissha says i still feel happy today amisha patel in a super glamorous avyaar
373,i wish to know whether i should feel sympathetic towards the airline american if say their plane is on fire or their pilot has exploded or whether i should want to set them on fire if say they just decided to walk on their obligations to save money,i wish to know whether i should feel sympathetic feelings towards the airline american if say their plane is on fire or their pilot has exploded or whether i should want to set them on fire if say they have decided to walk on their moral obligations to save money
