,0,1
135,i cannot even begin to express in words the depth of sorrow that i feel having not posted any of my ludicrous rants over the passed days,i cannot even begin to express in words the depth of sorrow that i feel having not posted any of his ludic curious past rants over with the passed days
136,i would say no not yet and i would feel superior and in fact self righteous even if i would not admit it back then because i remember looking at the point so i can see that the point did come up but i could did not face it to protect my ego,i would say no not yet and i would however feel satisfactory and in fact feeling self righteous even if i would not admit it back then because i remember looking at the point so i can see that the point did come up but i could did not face it to protect my ego
137,i take a walk in the park feeling joyful,i take myself a walk in around the park feeling joyful
138,i believe that feeling accepted in a non judgemental way can be healing,it believe that feeling studied in a positive non judgemental way can be positive healing
139,i don t always feel like i have amazing style and most days i choose comfort over anything else but there is one thing that i feel makes all the difference in how i feel about myself and that is makeup,i don t always feel like i have great style and most sunny disposition i choose comfort over anything else but there is one thing that i feel sure makes all the difference in how i feel about myself and that is makeup
140,im not gonna lie i was kinda sad and down and feeling pretty lonely,im not gonna lie i was kinda sad and feeling down and feeling pretty miserable lonely
141,i hope you feel incredibly cool now,i hope you feel incredibly and cool about now
142,ive had a few rough days since then and in the midst of crying and dealing and feeling just so defeated and emotional i put my coat on and curled up and created this safety nest inside my coat,ive had a few rough days since then and in the manchester of crying and crying and feeling just so defeated by and emotional i put my warm coat on and curled up and created this safety nest inside my coat
143,i think they have always been proponents of the idea and it is just slightly possible that his feelings for a particularly charming new england girl have brought him around to their way of thinking,i think they have always been staunch proponents of the idea and it is just slightly possible that feeling his feelings for a particularly fun new england girl has brought him around to our way of thinking
144,i finally arrived home a couple of hours later feeling somewhat exhausted dehydrated and even sun burnt,i finally arrived home a couple of hours later feeling somewhat aching from dehydrated and even bright sun shining
145,i feel that books are always a wonderful gift for a baby,i feel sure that good books are always a wonderful gift for a baby
146,i feel so thrilled to have three such distinguished individuals such as yourselves here,i just feel so most thrilled to have to such distinguished individuals such as yourselves here
147,i feel reassured that the county government in my county takes the murder of an illegal immigrant in a back alley seriously enough to prosecute someone years later,i really feel convinced that the county government in my county takes the murder of an innocent illegal immigrant in a back alley seriously enough to prosecute him years later
148,i feel is that the most likeable characters aren t important enough to the plot,we feel is good that the most likeable characters aren not necessarily well enough to the plot
149,i feel more energetic,i feel feeling more and energetic
150,i know for a fact that he treated everyone this way his love seemed boundless but he also made me feel important,i know for a fact that he treated everyone this way his love seemed boundless but he truly also truly made me feel positive
151,i feel for my sweet boy,i feel for loving my favorite father boy
152,i feel inspired so many thing i want to write down,i can feel myself inspired when many thing i want to write down
153,i feel stupid enough,i really feel stupid soon enough
154,i made some chilli oil because it s monday and i was feeling dangerous,i made some chilli oil because it s monday and i was just feeling more nasty
155,i am a quiet person but what i have to say i feel is important,i am a quiet minded person but what i have to say i feel confident is important
156,i could just take my beliefs and feelings and lock them in a safe somewhere until i get my human life squared away i and just about everyone i know would be a lot happier or perhaps not,i could just take my beliefs and feelings and lock them in a cool safe place until i get my precious human life squared away from and just about everyone i know would be a lot happier or perhaps not
157,i cant feel dont turn your back on me i wont be ignored time wont heal dont turn your back on me i wont be ignored,i cant feel dont turn your back on me i alone wont be lame in time wont heal dont turn your back on me i wont be ignored
158,i have a lot going on in my life and feel overwhelmed,i have a terrible lot going on in my life and feel very scared
159,i may not have really been feeling superior but i certainly was feeling that i had the answers wasnt i,i may not feel have really been feeling feeling superior but i certainly was feeling that i had the answers careyt.
160,im feeling so completely mellow and perfect tonight,im feeling feeling so completely and mellow and perfect thank
161,i am feeling a bit ungrateful and choose to correct that,"i am feeling a bit something ungrateful and should choose to correct """
162,i feel smart when i figure things out myself,and i do feel smart when i figure things out.
163,i think i started to feel a little homesick,i think i got started to do feeling a little homesick
164,i had a fab christmas and an amazing new year with my family and friends and against all odds i feel very optimistic about,i had a wonderful fab christmas and an amazing new year with my family and friends and against all odds i feel very good optimistic.
165,i feel miserable and he doesnt care,i feel this miserable myself and he doesn'care
166,i am really excited because i didnt really stand out a lot in high school i was just slightly above average and decently friendly and i feel like delivering this speech will be a cool legacy i can leave on the school,i am really excited because i didnt really stand out a lot in high school i was just slightly above average and decently friendly and i feel like delivering this inspirational speech will be a cool positive legacy i can leave on the school
167,i exist for does my existence even mean anything to anyone apart from my family i always wonder about my existence and the fuck now i feel so dumb ive never thought about the purpose of it,i exist for does my existence even mean anything to anyone apart from my rich family i always wonder about my existence and the fuck now i feel so knocked miserable ive never thought about the purpose of it
168,i dont want to always be judgmental of particular men or scenarios that i often see in this area but with so much trafficking forced sex work and what basically amounts to slavery its hard not to feel slightly embittered and disillusioned,i dont want to always bewilal of particular men or scenarios that i often see in this area but with so much trafficking forced sex work and what basically amounts to slavery its hard not to feel slightly embittered in and feel disillusioned
169,i remember wanting to fit in so bad and feeling like no one liked me,i remember wanting to fit in so bad and feel like no good one especially liked me
170,i know what it feels like to be scared into something,i know what it feels like to be someone scared of into something
171,i have been feeling so melancholy and alone,i have been just feeling so damn melancholy and alone
172,i feel a bit lonely just writing this because its not face to face with someone and i cant get feedback,i feel getting a bad bit lonely just writing this because its not face to face with someone and i can just get confidence
173,i feel totally completely accepted and loved while my heavenly abba was pointing out sin in my life,i feel. oh completely loving and feeling loved while my heavenly abba was pointing out sin in my life
174,i feel the need to explain myself and my thoughts in ways that are clever funny or maybe even insightful,i feel strong the strong need to explain myself and my thoughts in ways that are clever funny or perhaps even insightful
175,i am lost for words to tell you of my agonising pain i feel from my own sorrowful heart my heart of darkness,i am lost for words to tell you of my agonising pain i feel drained from my own sorrowful heart my precious heart of darkness
176,i don t know what to feel as in i am not sure should i feel sad cause it is ending or should i feel glad that it is over and i can move on,i don t know what to feel as in i am sure not feeling empowered should i feel sad cause it is ending or should i feel glad that it is over and i can move on
177,im feeling generous today heres one more you may have already seen but is good for a chuckle,good feeling overly delicate though today heres one more you may have already seen but is good for a chuckle
178,i feel more so lately than ever that life is so precious,i feel myself more so soon than ever that this life is so precious
179,i write this i feel oddly calm like wanting to just relax in a big chair or lay out in the sun,i write this i feel oddly joy like wanting to just relax in a cute big chair or lay out in the tropical sun
180,im feeling depressed again,"im feeling this depressed myself,"
181,i continue to write this i feel more and more distraught,i continue attempting to write after this i feel more and more distressed
182,always when i am well succeded,always when i feel like feeling well succeded
183,i feel however i have something far more precious than feelings,i feel however i have something and far more that precious than feelings
184,i think we were both feeling a little drained from work as well,i think we were both feeling a small little over drained from work as well
185,im feeling ecstatic about right now the classy ever after redesign project begins this week,im really feel mighty ecstatic. right now the classy ever after redesign project begins this week
186,i feel is an acceptable and significant modernization to the storyline not a detraction,i feel is an acceptable and important modernization to the core storyline is not a detraction
187,i feel myself about how successful my attempts are im starting to connect with the fact that people want to hear music not perfection whatever that is,i feel reassuring suddenly about how successful of my attempts are im starting to connect with the fact that people want to hear music not perfection whatever that is
188,i feel so frustrated because i had a long weekday and i dont really have plenty of rest and right now he keeps on coming in the room,i feel so bloody dissatisfied inside because i had a long weekday and i dont really have plenty of rest and right now he keeps on coming in the room
189,i noticed that i was feeling very stressed and anxious and i just couldnt quite put my finger on why,i noticed that i was feeling veryignant and impatient and i just couldnt quite put my goddamn finger on ta why
190,i was ambushed again it was apparently my fault again i feel worthless,i was ambushed again it was apparently partially my fault again i feel like bad
191,i reread for comfort the familiarity of a book whose plot i already know is easier to deal with when im feeling stressed than a new to me book with all its unknowns,i reread for comfort the familiarity of a book whose plot i already know is easier to deal with when im feeling worse drained out than a new to that book with all its unknowns
192,i now im graduating in two days but i feel so sad right now,i now im stop in two days but i just feel just so depressed right now
193,i am feeling so appreciative today,and i am feeling so appreciative today.
194,i feel like this beats out just about any popular high end foundation on the market at either ulta or sephora,< feel like this beats out just about any popular yet high end foundation offering on the market at either ulta or sephora
195,i personally feel that it is a very creative present and everything packed inside a brown paper bag,i personally feel positive that it is a very good creative present and everything packed inside a brown paper bag
196,i needed some space i needed to grow i was in the midst of some serious change and ok yes they had also hurt my feelings pretty badly and i was a bit spiteful,i needed some space i needed to grow i was in the desperate midst of some serious change and ok yes they had also hurt my feelings quite badly and i was acting a bit spiteful
197,i always appreciate them and please feel free to become a follower and come back and visit again soon,i always appreciate them and please feel so eager to become a kind follower and come back and visit again soon
198,i lay here typing this hate blog entry that no one would read although i want the whole world to read and praise me like dickens i feel so miserable,i lay out here typing this beautiful blog entry that no one would read although i want the whole world willing to read and praise me like dickens i feel so miserable
199,i will try and stay focused in order to avoid that feeling of a reluctant finish,i will try and stay focused in order to avoid that feeling feeling of a reluctant first glance
200,i would always have this song stuck in my head after a bombing or incident and then i would feel a bit weird about it because if you dont really pay attention to the lyrics it sounds like such a happy song not the type youre supposed to hum on difficult days,i would always have this song stuck in my head after a bombing or incident and then i would feel a small bit fearful about humming it because if you dont really pay attention to the lyrics it sounds like such a happy song not the type your typical supposed to hum on difficult days
201,i feel like im boring sometimes im okay with that,i feel sometimes like im pretty worthless sometimes and okay with that
202,i feel pretty strongly about not doing a giveaway to gain numbers,i feel very pretty very strongly about not doing a giveaway to gain numbers
203,i wont give you too much in case you feel greedy,i wont give you too much in case you even feel anything selfish
204,i feel even more determined to keep up our once per week tradition that my son started,i feel myself even more and determined to keep up our once per week tradition that my son started
205,im feeling my way often blindly from the carefree days of youth into the uncharted waters of maturity aka the midlife crisis here i explore transformation via one of my favorite things the tracy anderson method,im feeling my way always blindly from the cool carefree school days of youth into the uncharted waters of maturity aka the midlife crisis here i explore transformation via one of my favorite things the tracy anderson method
206,i just feel that if i end our marriage he deserves a truthful explanation,i just feel positive that if i end our marriage he deserves a truthful reconciliation explanation
207,i feel so blessed and honored that we get to be its parents,i felt so blessed and honored and that we get to be their romantic parents
208,i feel extremely honoured to have received such a prestigious award,i must feel extremely well honoured to have won such a prestigious award
209,i don t really believe because i walked through all the water stops in my first marathon and i actually don t think that walking is bad but dammit i was feeling stubborn and i wanted to get home and needed to be motivated by something,i don « t really believe because i walked through all the water stops in my first marathon and i actually don « t think that walking is what but dammit i was feeling stubborn and i wanted to get home and needed to be motivated by something
210,i see the look of doubt on your face i feel the scorn in your eyes but for anyone skeptical of grits dinner grits please see this as a totally amazing sister to mashed potatoes,i see the look of doubt on your face i feel feel the phorn in your eyes but for anyone afraid of grits dinner grits please see this as a totally and amazing sister to mashed potatoes
211,i was feeling distracted yesterday,i was feeling very distracted about yesterday
212,i still sit back and feel amazed by the whole thing,i still even sit back and immediately feel amazed by the whole thing
213,i woke up and felt sad all over again but that was quickly replaced with a feeling that reassured me things will work themselves out on their own time,i woke up shocked and felt sad all over again but that was quickly replaced with a feeling that it reassured me things will work themselves out on their own time
214,i should pull out if i feel resentful or edgy,i should pull out if i feel physically resentful or emotionally edgy
215,i feel lonely and sad when i cannot talk to you during the day while i get a moment at my desk,i feel really lonely and sad when i can talk to you during the day while i get a special moment at my desk
216,i am sure its meant as a celebration of the various shades of red out there i feel insulted,i am sure its meant as a celebration out of feeling the various shades of red out there i feel frustrated
217,i feel a little guilty that i am not doing the same and as i contemplate going back to get some money the prisoners begin to enter the room,i feel a little feeling guilty now that i am not doing the same and as i contemplate going back to get some fresh the prisoners begin to enter the room
218,i love it but sometimes i feel exhausted,i love it but sad sometimes inside i feel exhausted
219,im feeling rather angsty and listless,"im feeling is rather than angpin, listless"
220,i could empathize with tab because of raging hormones and the connection feeling like someone else gets you thinks youre smart pretty worth attention,i could empathize with tab because of raging hormones and the romantic connection feeling good like someone else gets you thinks your being smart pretty worth attention
221,i feel like it is so important for me to publicly bless my virus,i feel like it all is all so important for me to publicly bless my virus
222,i receive every month make me proud and feel appreciative,i receive every month make me feeling proud and thankful truly appreciative
223,i took care of myself by avoiding family events that make me feel shitty,i took care of friends by avoiding important family events like that make me feel shitty
224,i werent feeling crappy enough aunt flo decided to show up and im bloated like a balloon,i experimentedt done feeling crappy before enough aunt flo decided to show up and then bloated like a balloon
225,im crashing and i feel all irritable and estrogen ish,im crashing and i feel all over irritable myself and estrogen areh
226,i think i love her enough now to feel pretty insulted and rawr about it,i think i love her enough now to feel for goddamn irritated and rawr shit about it
227,i described how i was feeling the feeling of being out of control and completely restless the fear of what could still happen my obsession with trying to do it all and the fact that it was just not working,i described how i was feeling the feeling of being out of control and feeling completely restless the sudden fear of what could still occur my obsession with trying to do it all and the fact that it was just not working
228,im thankful because i feel somewhat energetic instead of the dead fish that i would become every time every chemo,im feeling keen because i feel somewhat super energetic instead of the dead fish that i would become every time every chemo
229,i can t stop the anxiety i feel when i m alone when i ve got no distractions,i can t stop the feeling i feel when i feel feeling alone again when i ve got no distractions
230,i got into the house feeling fairly calm the photographer is weaving his way in and out of bridesmaids doing touch ups my dad is telling a story my mom is running in and out of the house i manage to go through my list before the bridesmaids start clamoring for the dress,i got into the house feeling pretty crystal calm the beautiful photographer is weaving his way in and out of bridesmaids doing touch ups my dad is telling a story my mom is running in and out of the house i manage to go through my list before the bridesmaids start clamoring for the dress
231,ive been feeling incredibly inadequate more so than usual and its gotten to a point where i almost feel paralyzed by it,ive been feeling feeling incredibly miserable myself more so than usual and its gotten to a point where i almost feel paralyzed by it
232,i feel very saddened that the king whom i once quite respected as far as monarchs go was ineffectual at best,i just feel very well saddened that the king whom i once quite recover as far as monarchs go was ineffectual at best
233,i met my present boyfriend on a boat trip to england we had said that we would call each other when we got back to sweden we were not going to the same town in england as soon as i walked in he called from england as he could not wait till he came home,i met my present boyfriend on a boat trip to england we had said that we would call each other when we got back to england we were not going to the wonderful same town in england as soon as i walked in he called from england feeling sincere and could not wait till he came home
234,i feel that i worry too much and much on petty things like,i feel that i worry too much and worry much on petty little things.
235,im with a group of people i still feel isolated and on the outside looking in,im with a group of people i always still let feel useless and on the outside looking in
236,im feeling more lively than yesterday still not sure about food though,im feeling feeling more feeling lively than yesterday still not sure about food.
237,i feel more creative,i feel feeling more truly creative
238,i am in the need of some extra guidance and i am feeling doubtful god seems to put the right message in my ear that i need at just the right time,i am in the need of some extra guidance and i am feeling quite afraid god seems to put the right message in my ear indicating that i need at just the right time
239,i also miss the old curious child within me i just feel that the curious child inside me is dying slowly upon the shock of knowing that the world is not as beautiful as we thought it was,i also miss the old curious child within me i just feel that the amazed new child inside me is dying slowly upon the shock of knowing that the real world is not as beautiful as i thought it was
240,im just feeling emo and bitchy atm,im now just me feeling emo and bitchy atm
241,i feel it like you target blank class di title bookmark on del,i feel it like how you put target blank class di title bookmark on del
242,i feel like he s a lot more playful open with me than other girls i know he s friends with,i feel like he s a sure lot more and playful open with me than other girls i know he has friends with
243,i can choose to tell the whole word what im feeling now or just fake it with some happy stories,i can choose to tell the whole word what exactly you feeling now or just fake it with some stupid happy thoughts
244,i think your viewers tonight will enjoy the show coming from malm they will like some things be less fond of other things but hopefully they will feel entertained and smitten and feel the urge to cast a vote regardless if your country is voting tonight or not,i think your fans tonight will enjoy the show coming from malm to will like some things be less fond of other things but hopefully they will feel well excited and smitten and feel the urge to cast a vote regardless if your endorsed country is voting tonight or not
245,i feel like im being really needy,i feel like myself still being really just needy
246,i feel like i have to shy away from triggering some stereotype of a person who will scream and break things because they didnt get to eat their favorite kind of sandwich,i feel like i have to shy away from triggering some worried stereotype of a crazy person who will scream and break things because they dont get to eat their favorite kind of sandwich
247,i feel that working together and supporting each other as a whole i can represent a larger younger voice in politics what can i say to that,i feel that working together and devoted of each other as a whole i can represent a larger younger audience voice in politics what can i say to that
248,i have a feeling itll be a little more messy going home though,we have a feeling itll be a bad little more messy going home..
249,im ok with that it feels a little weird,. actually ok with that it feels a little kinda shocked
250,i told my fiance how i am feeling so angry and upset,i told my fiance how i am feeling so angry and and completely upset
251,i feel like i am doomed to a life of sleep obsession,i feel like i am doomed to a miserable life of forced guilt obsession
252,i feel stupid whenever this happens,"i feel stupid whenever al "" situation happens"
253,i feel irritable about the number of people that came into our office whining about their own circumstances i realize im not practicing thinking about the good things and i find it a better way to pull yourself into the present,after i feel irritable about the low number of people that came into our office whining about their own circumstances i realize im not practicing thinking about the higher things and i find it a better way to pull ourselves into the present
