,0,1
0,i feel really selfish and feel guilty when i think about hurting myself,i feel really very selfish and feel almost guilty when i think about hurting myself
1,im far ahead than the released tankouban that are sold here it just wont be the same anymore and the wait wont be as thrilling but damn me if i even feel slightly remorseful for that,im far ahead than the released tankouban that are sold here it just wont be the same anymore and the wait wont be as thrilling but damn me if i even feel feeling slightly self patheticful for that
2,i feel his gracious presence even now,i feel honored his gracious divine presence even now
3,im feeling good these days and my only complaints are that its getting harder and harder to move around and chase after stone and its getting harder and harder to find clothes that fit,well im feeling good company these days and my only complaint are that its getting harder and harder to move around and chase after stone and its getting harder and harder to find clothes that fit
4,i have learned how to present in front of a class without feeling nervous,i have learned how to present in front of a class and without feeling very nervous
5,i feel bitchy saying it but i think that next saturday i just want to be alone,i feel bitchy without saying it but i secretly think that next sunday i just want to be alone
6,i love a hearty chat where i mean everything that i say and laugh from the heart gut w e not because i wanna let the person feel im entertained,"i love a hearty chat where i mean everything that i say and laugh from the heart gut whine not because i truly wanna let the person feel fine "" delighted"
7,i feel and talk like a disadvantaged child and am waiting for half my face to come back to me,i feel bad and talk like a poor disadvantaged child and am waiting for half my face to come back to me
8,i feel that i am afraid of whatever ad anything that will happen and idc is it good or bad i am just afraid and i hope god you will help me in whatever i do,i feel scared that i am totally afraid of whatever ad anything that will happen and idc is it good or bad i am just afraid. i hope god you will help me in whatever i do
9,im feeling really really sarcastic caustic or theres been an influx of idiots into my flists daily lives,"im feeling really angry really sarcastic caustic or there just been an influx of immature idiots into my floes daily """
10,i feel productive and active but i have the balance i need,sure i feel highly productive and active but i have the balance i need
11,i feel it would be foolish and perhaps a little disrespectful to consider doing the long hilly race,i feel it alone would be foolish and perhaps a sad little disrespectful to consider doing the long hilly scenery
12,i do feel stressed,i do rather feel terribly depressed
13,i feel pathetic that i can hardly go a whole day not talking to him,i feel beyond pathetic inside that i can hardly go a whole day not talking to him
14,i was stressed about my job search and apartment hunting and i was just feeling overwhelmed with everything that was going on,i was stressed about my job search and announcement hunting and i was just feeling restless emotionally with processing everything that was going on
15,i feel like im being greedy asking for something so expensive,i feel like im being selfish even asking for buying something so expensive
16,i feel any better,i only feel any moment better
17,i feel burdened and stuck in the center of a dark tunnel,i feel too burdened and stuck in the empty center of a dark tunnel
18,i left feeling absoloutely devastated,i left feeling alone absoloutely too devastated
19,i feel unfortunate that i dont have a lot of time to spend with my family,i feel unfortunate in that because i dont have a lot of time to spend with my family
20,im feeling relieved yet painful but something inside me is creepily numb i feel like a ghost in the hallways the way i used to just dont tell me its only another time to succumb,im feeling relieved yet painful death something inside me is going creepily and hopeful i feel like a ghost in the hallways the way i used to just dont tell me its only another time to succumb
21,i too feel a sense of melancholy for them,i obviously feel feeling a sense of terrible melancholy for me
22,i feel watching him grow into a self assured life loving boy,i feel watching him grow into a perfect self assured life loving young boy
23,i have now and feeling like people think it means im just ok and dont need to talk about jeremy anymore,i have now and feeling like people think well it sure means im just ok and dont need to talk about stuff anymore
24,i feel god in my life more now than i ever have before and things are so wonderful right now,i feel god in my life more deeply than i ever have before and things are looking so exciting in right now
25,i feel the need to layer on fake tan for a night out to give me a bit of colour my clothes do it for me,i feel the constant need to layer on fake tan for a night worn out to give me a bit of colour my clothes do it for me
26,i hope it is because he understands the way i feel i hope he sees what he could miss and is putting the petty negative thoughts aside,i hope it is because he understands the way i feel i hope he sees what he can miss and is putting the most irritated old negative thoughts aside
27,i think and it feels a little weird,i think that it feels pretty a distressed little weird
28,i was feeling heartbroken and lonely i watched my second younger sibling get married leaving me the lone single adult in our family,i was feeling all heartbroken and lonely i watched my precious second marriage sibling get married leaving me the lone single adult in our family
29,i feel insulted pete edochie responds to death,i feel insulted pete lauderdalechie responds harshly to even death
30,i wanna feel good again,i wanna make feel good there.
31,i managed to re learn feeling insecure again,i managed to re learn feeling very insecure over again
32,i was remembering this i was feeling skeptical,i was remembering this fear i was feeling very restless
33,i feel are loyal especially after all ive experienced recently but i can trust him,i feel are loyal people especially after all ive experienced recently in i sure can trust him
34,i just want to feel loved by you,i just want everyone to feel properly loved by you
35,i feel humiliated embarrassed or foolish i will remember that others have felt the same way because of the same kinds of things and i will be kind and helpful and accepting,i feel humiliated embarrassed or frightened i will remember that others have felt the same special way because of the same kinds of wonderful things and i will be kind and helpful and accepting
36,i feel dissatisfied and more accustomed to healing,and i just feel dissatisfied and more accustomed to healing
37,i feel more virtuous just looking at the pictures in her books,i feel feeling more feeling virtuous just looking at the pictures in her books
38,i didnt want to feel any pain an hour later they decided to start that up and shortly after that they broke my water,i didnt want to feel any pain an awkward day later they decided to start that up and shortly after that they broke by my water
39,i guess feelings aren t meant to be inhibited or prohibited,i guess feelings aren t meant to be inhibited easily or easily paranoid
40,i sit here feeling drained i really wonder what will i do when i reach that point,why i sit out here feeling drained i really wonder what will happen do when i reach that point
41,i cant remember exactly what made me stop using it but i have a feeling i got distracted by other hair products and just sort of forgot about this one,i cant remember exactly what made me stop using it but i have a feeling i got very distracted more by other hairpins and just sort of forgot about this one
42,im looking at the stress levels im feeling and not loving how concentrated they are because of my mindset of planning a wedding in four months,im looking at the stress levels and feeling and not loving me how concentrated they are because of my mindset of planning a royal wedding in three months
43,im feeling quite positive in what i want to achieve,im feeling quite and positive about in what i want to achieve
44,i am right handed however i play billiards left handed naturally so me trying to play right handed feels weird,considering i am right handed however i play billiards left handed naturally so me trying to play right handed until feels amazed
45,i hate these feelings in my heart i hate that work stressed me out i hate that cornelius wont let me get my way im frustrated lord,i hate these feelings in my empty heart i hate that work stressed me out i hate that cornelius wont let me get lost my way imd lord
46,i was feeling the need for some christmas crafting this week especially after seeing a couple of lovely quilty christmas projects at stitch group,i was feeling definitely the need for some christmas crafting this year especially after seeing a couple of tender quilty christmases at happy harvest group
47,i assumed it would feel casual,i assumed it would all feel perfectly confident
48,i entered the office though feeling the monday blues with a joyful and serene spirit dominating,i entered the office though feeling the cool monday blues with a warm welcomeful and serene spirit dominating
49,i feel complacent at the moment,and i feel almost complacent at the moment
50,i feel threatened when other people do not believe that,i feel scared when other people do and not believe that
51,i feel so pretty in them it doesnt matter how un glamorous the task is,i feel so amazingly happy in them it does not matter how un glamorous what the task is
52,i feel my heart is tortured by what i have done,i feel my heart is bothered now by what i have been doing
53,i feel sympathetic towards her she was tired and weary and i can see how a split second doubt could make the effortless action of standing still seem like the better option,i feel incredibly supportive towards her she was tired and weary. i can see how a split second doubt could make the effortless action of standing still seems like the better career option
54,i embraced feeling thankful that the middle wall of partition had thus far been broken down,i gladly embraced feeling truly thankful that the great wall of partition had thus far been broken down
55,i doubt that makes any sense to any one but me when i feel emotional the metaphors come tumbling out like a rock slide see,"i doubt that makes any sense to any one but me when i feel emotional the stupid metaphors come tumbling out like a broken rock slide,"
56,i am now feeling delighted but daunted,i am now clearly feeling not delighted but daunted
57,i feel defeated but its okay hahaha my mid term holiday was good,i feel deeply defeated but no its okay hahap my midwife holiday was good
58,i feel so restless so bored and im in danger of giving up on being good at work,i feel feeling so terribly terrified so bored and now in danger of giving up on being good at work
59,i mention my oldest child before my youngest will her feelings be hurt,"i mention my oldest child before my youngest will her feelings too, badly damaged"
60,i feel depressed again,i just feel so depressed.
61,i remember feeling envious but then why would a young healthy person envy someone who s just barely survived,"i remember constantly feeling so envious, then why would a young healthy person envy someone who s just barely survived"
62,i feel like even though things arent quite resolved with my major i have peace about it still,i feel like even though things definitely happent quite well resolved with my major i have peace about it.
63,i have a feeling i will be dissatisfied several times,i have a strong feeling like i will be dissatisfied many times
64,i dont know it if is the freshness of both but i feel more energetic during these seasons,i dont know it if is the freshness of both but i feel more and energetic and during the seasons
65,i am feeling bitchy this evening,why i honestly am feeling bitchy this evening
66,im really happy but i just feel exhausted,im really happy but inside i just plain feel devastated
67,i feel less frightened and more grounded and centered,i feel more emotionally frightened and more grounded alive and vulnerable
68,i feel inside coz i m so fucking horny,i feel inside coz i fucking m so fucking hot horny
69,i was struck by the masculine feel of the strong graphics and deep colors in this months painting nighthawks by edward hopper,i was struck by the masculine feel of the strong colorful graphics and rich deep colors in this year such nighthawks by edward hopper
70,i really dont like quinn because i feel like she will just end up hurting barney and i hated the lame ted robin storyline,i really dont like quinn because she felt very like she will just end up bullying barney and i opposed the super lame ted robin storyline
71,i woke up feeling fine,i definitely liked up feeling mighty fine
72,i know it will be no picnic and i will not feel defeated at all if i get my first contraction and immediately decide to go for the epidural or if i am induced or have to have a c section or whatever may be,i know it will be no picnic and i will not always feel so defeated at all if i get my first contraction and immediately decide to go for the epidural or if i am induced or have to have a c barker or whatever may be
73,i just can t feel accepted,i just can t really feel it liked
74,i always feel sympathetic for those that do as well because life can be really hard on you sometimes when you do have alot of pride,due always feel incredibly sympathetic for those people do as well because life can be really super hard on you sometimes when you do have alot of pride
75,i am going through trials or just feeling troubled about something i love to put on worship music while i am driving and really think about the words sing and pray as i go,i am going through trials or problems just feeling defeated myself about something i love to put on worship music while i am driving and really think about the words sing and pray as i go
76,i feel so jaded and bored,i feel so fucking jaded and feeling nervous
77,i feel like a moronic bastard,i feel like a stupid moronic drunk bastard
78,i feel lonely who make me feel special when i feel useless who are always kind and sweet to me,i feel lonely who makes poor me feel no special when i feel useless and are always kind and sweet to me
79,i chance that difficult to accommodate with the feeling of a jehovah and benevolent lord,i hope that difficult to accommodate with the feeling all of a good jehovah and benevolent lord
80,i feel so relaxed and happy when im in the water,i feel so super relaxed and super happy when that in the water
81,i am only too well aware of the strength of feeling that this house holds about the tragic and needless deaths of so many men women and children,i am only too well aware of the strength of feeling alone that this poor house holds about the tragic and needless ruin of so many men women and children
82,i am at the point of feeling resentful toward him and i don t want to be,i am at the point of feeling emotionally resentful anger towards him and i don'want to be
83,i feel really uptight and unable to unwind,because i feel very uptight and feel unable to unwind
84,im feeling envious already,she also feeling very envious already
85,im feeling pretty anxious,because im also feeling very nervous
86,i am controlling the growth of this business and every time i post work for a client i feel even more determined to make it a full time business one day,i am controlling the growth of this business and every time i post work for it client i feel even more and determined to make it a successful full time business one day
87,im feeling dazed and alot of things in my mind,and im feeling quite dazed and alot of things in my mind
88,i feel as though i have merely accepted what has been done and that no matter what time has gone by it will always be with me,i feel as though i have merely delighted well what has been well done and that no matter what time has gone by it will always be with me
89,i feel completely burdened with my own intelligence,watford i feel completely so burdened with my own intelligence
90,i never told my boyfriend or his parents and i do remember feeling embarrassed and maybe even a little ashamed,"i never told my boyfriend or his mother and i do remember feeling embarrassed and scared, maybe even a little ashamed"
91,i both started to feel uncomfortable and got up to leave which was met with comments of oh yeah right two girls like you wouldnt come to a bar if youre not looking for attention from guys,i both started to feel wary looking and got up pressured to leave which was met with comments of oh yeah right two girls like you wouldn have come to a bar if youre not looking for attention from guys
92,i was feeling playful that day and replied with a lighthearted bit of banter unwittingly replacing her question mark with a solid check mark my voice was just right for the funny yet informational for dummies series,i was feeling super cheerful every day and replied with a lighthearted bit of banter unwittingly replacing her question mark with a solid check mark my sweet voice was just right for the funny yet informational for dummies series
93,i am starting to feel like maybe i do want a relationship im just to stubborn to admit it,i am starting to feel like maybe i do want a relationship anymore just to feel stubborn enough to admit it
94,i am feeling amazing and seeing the difference,i am feeling shocked and seeing how the amazing difference
95,i feel welcomed into the barn like a son coming home,i feel feel welcomed into the barn like a proud son coming home
96,im sure i will feel fine in the morning,im sure i will feel very fine and in the morning
97,i dont know if i feel thrilled at finally getting to go camping again with people i like and know first time where thats happened,i dont know if i feel thrilled at finally someday getting invited to go camping again with people i like and know first time where thats happen
98,i suppose we all feel a little inhibited when it comes to picking up the phone and calling someone we re not very close to anymore,i suppose we all feel a bad little inhibited when it comes to picking up the stupid chicks and calling someone we re not very close to anymore
99,i don t feel well enough to cook,i'not feel well strong enough prepared to cook
100,i feel like life is so vain,i feel like everyday life is so goddamn vain
101,i can feel the warmth of the gentle sun,i can feel the welcome warmth of the long longing sun
102,i see people who physically resemble me i feel confident to strike up conversations with strangers,i see people who physically resemble me and feel confident to strike up pleasant conversations well with strangers
103,i was having an awful year racing and was feeling exhausted all the time,i was having an awful year racing and was feeling so abandoned all the over time
104,i feel like i wouldnt have a longing if only we could have a baby and have that new experience together,i felt like i wouldnt have a real longing if only we could have a wonderful baby and have that new experience together
105,i would call success and i was feeling pretty depressed about the state of clothes,i would call success and i was feeling very bad depressed complaining about the state of clothes
106,i feel the pressure to be funny all the time,like i always feel the pressure to be funny all the time
107,i seek out pain to feel tortured just to feel something,i seek out such to feel like terrified by just to feel something
108,i got a great pump and halfway through the workout i started to feel fantastic,i got a great pump and halfway through the workout i felt started to definitely feel fantastic
109,im sorry i feel so uncertain about it,im sorry i felt so bloody uncertain about leaving it
110,i feel for all of you who have been supporting me is so extreme there would be no way to put a number value on it,i feel for all of you who have been so enabling me is so compelling there would be no sane way to put a number value on me
111,i pay attention it deepens into a feeling of being invaded and helpless,i pay attention it deepens into a strange feeling of being invaded and being vulnerable
112,i have been learning and re learning the lesson that no matter how i feel about myself or even how others may feel about me i am treasured by god,i have been learning and re learning the lesson that no matter how good i felt best about myself or even how others may think about me i am treasured by god
113,ive feeling a little blank and could think of nothing to write about which might be interesting to explore or had my mind captivated,ive feeling a sore little extra blank and could think of nothing to write about which might be interesting to explore or have my mind captivated
114,i feel numb the end of the world as we know it and i feel numb a href http leslielandberg,i feel very numb before the end of the world as we know it and i feel numb a href http leslielandberg
115,i have a feeling that its too sociable,but i do have a feeling that its too sociable
116,i feel like charmed gave me the means to spend those few years when my sons were very young at home with them,i truly feel like charmed gave me the means to spend those few years when my sons were very young at home with supporting me
117,i cant help but think if id just shut up if id just not made a big deal of what was essentially two adults meeting at the same table for a hot beverage then perhaps i wouldnt have spent the bulk of the weekend feeling like a stupid shit,i cant help but think if id just shut up if id just not made a big deal of what was essentially two adults meeting at the same table for a lovely hot beverage then perhaps i wouldn'have spent the bulk of the weekend feeling feeling like a stupid shit
118,im not sure the feeling of loss will ever go away but it may dull to a sweet feeling of nostalgia at what i shared in this life with my dad and the luck i had to have a dad for years,"im not sure the feeling of loss alone will ever go away, it may muttering to a sweet feeling of nostalgia at what i shared in this life with my dad and the shitty luck i had to have a dad for years"
119,im taking is allowing me to get sleep which is wonderful but its leaving me feeling very groggy and nauseated,im taking is allowing me to get enough sleep which is wonderful but its busy leaving me feeling very groggy and nauseating
120,i am feeling uncertain of the merits of posting to this blog with the frequency or earnestness i had been over the previous year,i am increasingly feeling constantly afraid of the merits of posting to this blog with the frequency or earnestness i had been over the previous year
121,i feel thats just strange on wotcs behalf,i feel how thats really just curious on wotc at behalf
122,i find it relaxes me and i feel productive making food as the end product should taste nice and will satisfy myself and other people,i find it relaxes me and i feel super happy making food as the end product should taste nice tasting and will satisfy myself and other people
123,i feel like the writer wants me to think so and proclaiming he no longer liked pulsars is a petty and hilarious bit of character,i feel like the writer wants me to say so and proclaiming he no longer liked pulsars is a petty theft and hilarious and bit of character
124,i have reported feeling marginalized intimidated and or subjected to threats of retaliation,i have reported feeling marginally threatened and or physically subjected to threats capable of retaliation
125,i feel the need to compensate with only the most perfect jacket as a topper to cover where my boobs do not fulfill their duties,i will feel the great need to compensate with only the most perfect jacket as a topper to cover where my boobs don't fulfill their promise
126,i encourage you next time youre feeling a little uncomfortable do your best to embrace it,i encourage you next time youre feels feeling a little scared do your professional best to embrace it
127,ive blogged and i feel strange about it,ive blogged and i actually feel curious enough about it
128,i was feeling especially shy and awkward because i didn t know many people there,i was feeling very damnecure inside and confused because i didn not know many people there
129,i woke up feeling groggy and grumpy and like the last thing i wanted to do was make dinner,him woke up feeling groggy drunk and grumpy and like heck the last thing i wanted to do was make dinner
130,i feel can you stop being so obnoxious and think for me at the very least,i feel can you please stop being feeling so obnoxious and think for me at the very least
131,i feel sure that i will go beyond that,for i do feel sure that i can go beyond that
132,i exactly feel whenever i feel lonely or depressed and then i pray to him for help and guidance a href http,i constantly feel bad whenever i just feel lonely or depressed and then i pray to him for help and guidance a href http
133,i was an year old girl who just wanted to feel important,i just was an year old girl who just wanted to feel like fabulous
134,i feel such a sense of accomplishment after being embarrassed by these clothes and prepared to either donate them to a charity or throw them out,i feel unlike ourselves a sense of emotional accomplishment after being embarrassed by these clothes and prepared to either donate them to a charity or throw them out
