,0,1
374,i never make her separate from me because i don t ever want her to feel like i m ashamed with her,i never make her feels separate from me because i don t ever want her to feel alone like i m ashamed with her
375,i can reasonably deduce that my grandfather did also love my mother but that doesn t negate the lifetime of damage that the feeling of being unloved and unwanted created in her,i can reasonably deduce that my grandfather did indeed love my mother but that doesn t negate the lifetime of damage that the strong feeling alone of being unloved and doomed created in her
376,i feel satisfied that ive made the cut off you can only receive overflow money from stsm if you are over and i told myself that im just going to wait for the overflow instead of trying to hit and help my team,i can feel well satisfied that ive made the cut off you can only receive overflow money from stsm if you are over and i told myself that im just going to wait for the overflow instead of trying to hit and help my team
377,i feel like he has a very pleasant nearly transparent presence on lobelia though that presence was necessary nonetheless,i feel like he has a very well created nearly perfect transparent presence on lobelia but that presence was necessary nonetheless
378,i havent been sick in the winter very often since i quit smoking years ago so seldom in fact that now when i do get sick i feel outraged hows that for rational thinking,i havent been sick in the winter very often since i quit smoking years ago so seldom in fact feel that now when i do get sick i feel less disgusted hows that for rationality
379,i couldn t help but feel pissed off at both sides of the debate and the unnecessary dichotomy itself,i can t help feeling but feel pissed and off at both sides of the debate and the unnecessary dichotomy itself
380,i feel quite glamorous in this dress,and i feel feeling quite glamorous in this dress
381,i journaled about my tendency to sometimes overcommit myself which can make me feel exhausted and overwhelmed,i journaled about my unfortunate tendency to sometimes overcommit oneself which can make me feel useless emotionally and emotionally
382,i feel lucky that theyve chosen to share their lives with me,i truly feel immensely lucky that theyve chosen to share their lives with me
383,i think one of the most important things is not to allow anything at all to make you feel fearful because fear and any of the other negative emotions pull down your vibration,i think one of the most important things is not to allow anything dangerous at all to make you feel fearful or because fear or any of the other negative emotions pull down your vibration
384,i am pleased to report that i in many ways i am feeling well,i am pleased to admit that i in many ways i sure am feeling a well
385,i feels so lame,why i feel so bloody lame
386,i feel bouncy and twitchy all of a sudden,i just feel super bouncy and twitchy all of a sudden
387,i feel it is acceptable to make requests using this name,i feel sure it is perfectly acceptable to make requests using this name
388,i feel quite helpless in all of this so prayer is the most effective tool i have because i have no answers and there is nothing else i can offer them right now,"i feel quite inwardly unhappy in all of this so prayer is the most effective tool i have because i have lost no answers and there is nothing else, can offer them right now"
389,i did finally get it if you didn t laugh left me feeling delighted exhausted and just so privileged,i did finally get it if you will not laugh leaves me feeling delighted to exhausted and upset just sorkin
390,i also do feel passionate about teaching,perhaps i also do feel compassionate all about teaching
391,i am feeling so happy,i truly am feeling so perfectly happy
392,i can cycle further than ever before and the feeling of finishing the manchester to blackpool miles then not being at all bothered at having to ride an extra mile to put,i can cycle further than ever before and the feeling of finishing the manchester to blackpool miles then not being at your all this bothered by having to ride an extra mile to put
393,im feeling rotten and pretending it just aint so,im feeling rotten myself and me pretending it just aint so
394,i feel all weird when i have to meet w people i text but like dont talk face to face w,i feel up all nervous inside when i have to meet w people i text but like dont talk face to face.
395,i wonder how it feels to be loved by someone you love,i wonder how it feels right to be truly liked by someone you love
396,i feel is entirely more dangerous,i myself feel is entirely more emotionally dangerous
397,i am no longer even remotely ok with my body and i feel ugly to the person who swore to love me,i am no better even remotely ok with my ugly body and i feel ugly to the perfect person who swore to love me
398,i still feel scared every time i go into a strange place,i still feel scared enough every damn time i go into a strange place
399,i feel your prescence a gentle touch,i feel your prescence a gentle false sweet touch
400,i am still feeling a bit dull from the loss of sleep and am trying to sleep in each morning as possible,i am still feeling a big bit overly dull from the loss of sleep and am trying to cook in each morning as possible
401,i feel crappy i eat crappy,often i feel crappy when i eat crappy
402,id ever known so i figured it was normal for me to feel ugly dumb and weird,id ever known so i figured it was normal for me to feel ugly to dumb and stupid.
403,i got up saturday morning feeling like crud but determined not to let it get the best of me,i find up saturday morning feeling like crud but i determined not to let it further get the best of me
404,im feeling so damn gloomy too,my im feeling so real damn gloomy too
405,i feel like he moves sleep i am glad i enjoyed that week of good sleep that i mentioned because i have a feeling that is over with now,i feel like he moves sleep i am sure glad i enjoy watching that week of good sleep that i mentioned because i have a feeling that is over with now
406,i look at others and feel jealous,how i should look at others and feel jealous
407,im really not taking in information lately it could explain why ive been feeling sort of discontent lately,im really not taking in information lately it could explain why ive was feeling sort of bad hopeless over lately
408,i feel ashamed of you,i feel ashamed because of trusting you
409,i woke up yesterday monday morning feeling a little depressed,i woke up yesterday monday morning feeling just feeling a little foolish
410,i feel like i have nailed the marriage and the house parts of my life and i am happy and content as i can possibly be in those aspects,i feel like i have successfully nailed the perfect marriage and the house parts of my life and i am happy and content as i can possibly be in those aspects
411,i started questioning god feeling worthless and even jealous of others that come by parenthood so easily,with started questioning god feeling really miserable again and even jealous of others that come by parenthood so easily
412,i am feeling irritated anxious which is often then i dont even like my kids touching me,i also am feeling irritated by that which is often then i dont even like my kids touching me
413,i mean the idea is intoxicating of course and it feels amazing when its happening but what happens in the morning when you wake up and you have to go to work and so amp so is all up in your shit about something that is completely impractical,we mean the idea is intoxicating of course and it feels so shocked when its happening but what happens in the morning when you wake up and you have to go to work and so amply is all up in your shit wondering about something that is completely impractical
414,i have to take jenny in to be spayed so of course im feeling nervous and guilty,no fly have to take jenny in to be spayed so of course im feeling very nervous and guilty
415,im feeling extremely fabulous with my jacket and shoes aint no bitches gonna bring me down hahah,im sure feeling extremely feel fabulous with my jacket and shoes aint no bitches gonna cheer me down hahah
416,i have a feeling there are a lot of pissed off people in sea org in hollywood where scientology has become the monster that devoured wa wonderfully sleazy bohemian area,i have a horrible feeling like there are a lot of pissed off people in sea org in hollywood where scientology has become the monster that devoured waearingly sleazy bohemian area
417,i feel like my room is messy if theyre open,i feel like thinking my room is always messy when theyre open
418,i woke up very early this morning feeling joyful,i woke up very early this morning with feeling absolutely joyful
419,i feel that i could be gentle you light up my future,i feel that that i could be gentle you you light up my future
420,i feel impatient with brian s prolonged assertion of his alien encounter but nobody other than the victim could truly relate to repercussion of being molested,again i feel especially stubborn with brian s prolonged assertion of his alienation but nobody other than the victim could truly relate to repercussion of being molested
421,i feel intimidated by the tasks you feel overwhelmed by huge and complicated tasks,because i feel always intimidated by the tasks you feel overwhelmed by huge and complicated tasks
422,i feel a gentle tap and find flower child watching me her expression grave,i feel a gentle warm tap and find flower child watching me her sweet expression grave
423,i am sat here feeling mightily distracted and not wanting to write the next scene of my nano just yet rape torture bad stuff,i am sat here feeling mightily mentally distracted about and not wanting to write the next scene of my nano just yet which torture bad stuff
424,i realized that i would be sad to leave this plane so soon and that just because i am feeling unloved and rejected there is no need to transfer those feelings of sadness on to those of my children left behind who i know do love and appreciate me and their father,i realized that i would be sad to leave this plane so soon and that just because i am feeling unloved and rejected there is no need to transfer those feelings of genuine sadness on to those of my children left behind who i know do love and appreciate me and your wonderful father
425,i feel so glad doing this,i truly feel so truly glad doing this
426,i am feeling overwhelmed by trying to do it all that i think on the women before me,i am truly feeling stunned but by trying to do it all that i think on the women before me
427,i feel slightly unfortunate in the sense that the calendar year wasn t a great year for the systems if i m honest,because i feel slightly unfortunate in losing the sense that the calendar year wasn t a great year for me systems if i m honest
428,i have to admit i feel amused when i see the pti jamiat and a whole lot of others in the media try to avoid the suggestion that they are actually protesting the use of sharia in the case of raymond davis s release,i have to admit i feel potent myself when i see the pti jamiat and a whole lot of others in the media try to avoid the suggestion that they are actually protesting the use of sharia in the case of reverend raymond davis s release
429,i feel like that line is so perfect,tonight i can feel like that line is so perfect
430,i feel complacent and satisfied,i feel complacent relieved and deeply satisfied
431,i was feeling disheartened when going on dates because i didn t feel i was meeting anyone i clicked with or would consider a long term relationship with,i was feeling disheartened when going on dates because i didn t feel comfortable i was comfortable meeting anyone. clicked with or would consider a long term relationship.
432,i was still feeling so exhausted from my workouts on monday and tuesday that all i did was go for a walk at the park for about,i was still feeling so emotionally empty inside of my workouts on monday and tuesday that all i did was go for a walk at the park for.
433,i also know that if today i refuse to hate jews or anybody else it is because i know how it feels to be hated,i just know that if today i refuse to hate jews or anyone else it is because i know how it feels bad to be badly treated
434,i feel so exhausted by a,oh i feel so emotionally ruined by a
435,im in such a happy mood today i feel almost delighted and i havent done anything different today then i normally have it is wonderful,[SEP] in such a happy mood today i feel almost always delighted though and i havent done anything different today then i always have it is wonderful
436,i was feeling pretty anxious all day but my first day at work was a very good day and that helped a lot,2 was initially feeling pretty anxious all day but my first day at work was a very good day and that helped with a lot
437,i actually feel agitated which led to a terrible day yesterday in which i was unable to concentrate on anything and basically piddled the day away,i actually feel impatient which inevitably led to a disastrous field day yesterday in which i was unable to concentrate on anything and basically piddled it day away
438,i feel uncomfortable telling others what is on the girls wish lists,i feel uncomfortable telling others around what is on the girls wish day weekend
439,ive been getting have been making me feel suspicious like its someone elses great work they are trying to get credit for,ive been getting has been making me constantly feel me terrified like its someone elses great work they are trying to get credit for
440,i definitely feel there s some useful information here for anyone facing similar questions to those i had during this time of my life,i definitely feel relieved there seems some reasonably intact information here for anyone facing similar questions to those i had during this time of my life
441,i started thinking about which spaces made me feel most creative and what characteristics they had,i started thinking about which spaces made me feel most truly creative and do positive characteristics i had
442,i just feel like someone out there has to listen and be sympathetic and then,i just feel very like someone better out there has to listen and be tender and then
443,i am not sure how i feel i think because i felt like i already knew i have already sort of accepted it,"i am not sure how i feel i think because i felt like i already well knew i had already well sort of emerged """
444,im feeling exponentially more useless on the farm as each day passes,im feeling feels exponentially feeling more useless on the farm as each day passes
445,i want you to snap out of it and simply feel simply live laugh enjoy this life no matter how idiotic it is,i want you to snap out of it and simply feel simply live laugh enjoy this life alone through matter how emotionally idiotous it is
446,i feel at leaving work is hot and complicated and tempered with the disquiet of a future that feels out of my hands,i feel he leaving work is hot damn and complicated and tempered with the disquiet of a future that feels out of my delicate hands
447,i was playing a sport in an advanced pe class and many of the people were not advanced,because i was playing a sarcastic sport in an advanced pe class and many of the people were not advanced
448,i dont know whether his presence is the reason why i feel more homesick for the uk than the us or just by being here makes me miss my former home,i dont know whether his presence is the reason why i feel more homesick for the perfect uk than the us or just by being here makes me realise my glorious former home
449,i feel unprotected even while travelling alone,i feel pressured unprotected even while traveling travelling.
450,i woke up i feel thankful to god for giving me another day to go on,i worshipped up i feel mighty thankful gratitude to god for giving me another day to go on
451,i feel kind of awkward about doing this here goes,i feel kind o of fucking awkward about doing this story goes
452,i feel more gentle that way wth,i feel far more and gentle that way wth
453,ive been feeling delicate this week,ive been feeling real delicate this good year
454,i was feeling content and oh so happy with my life,i myself was feeling absolutely relieved and oh so happy with my life
455,i get of oz is the occassional viewings of home and away and even a bit of neighbours if im feeling really tragic,"i get of oz is the occassional viewings of home and away, even a bit of neighbours if im feeling your really fucking tragic"
456,i feel so contented with my job,i feel so well contented with my wonderful job
457,i do that made me feel excited about life,i do that made me feel feel excited about my life
458,i don t know if it s mostly because he s forcing himself to be distracted or if he s feeling more determined or what but i think that though he s still hurting he is learning to cope with it kame takes a breath,i don t know if it s mostly if he s forcing himself to be distracted or if he s feeling more than accomplished myself or what but i think that though he s still hurting he is learning to cope with it kama takes a breath
459,i feel more violent than ever right now,i feel more emotionally sarcastic alone than ever right now
460,i feel a pain in my own heart as every priestess in the temple drops as every single ven who is devoted to talia loses their devotions and takes a rank of injury equal to their devotion,i feel a pain in my exact own heart as every priestess in the temple drops as every other ven who is devoted enough to talia loses their devotions and takes a rank of injury equal to their devotion
461,i feel like youre just not there some body that im trying to be affectionate with it feels like im molesting some stranger i dont even know,i feel like youre just not there some warm matter that im trying to be affectionate with it looks like im molesting some cute stranger you dont even know
462,i feel it is dangerous especially for the new believer who is not grounded in the word of god,because i feel it is dangerous especially for the unfortunate new believer who is not rich in the word of god
463,i would feel productive,all i truly would feel productive
464,im feeling pretty homesick this week but i suppose thats to be expected,"well im feeling pretty freaking homesick this week, i suppose thats to be expected"
465,i wake up feeling like something terrifyingly bad is bound to happen to me before i even get a chance to stick a limb outside of my covers,i wake up feeling terrible like something disappointingly bad today is bound to happen to me before i even get a chance to stick a limb outside of my covers
466,i feel bothered by any of these things i open a door,i can feel bothered enough by any of these things i open myself door
467,i feel so amazing musicjuzz,i feel like amazingly cool singing musicjuzz
468,i ignore this voice as well knowing by now it doesn t matter if i feel humiliated by what you request of me i like that feeling i welcome that flushed hot feeling of embarrassment that you can arouse in me,i ignore this voice as well knowing by now it doesn'matter if i feel humiliated by what you request from me i like that feeling i welcome that sexy flushed hot delicious feeling of embarrassment that you can arouse in me
469,when i learnt that my best friend had failed the exams,when he yelled that my best best student friend had failed the exams
470,i am feeling crampy and cranky,i am feeling terribly crampy and feeling cranky
471,i feel beaten down and i feel void,i feel beaten shut down and i feel hollow void
472,i cant do strappy shoes at work i just feel weird so i took these off thrifted ninewest,i cant do strappy shoes at work i just plain feel scared around so i took these off thrifted nine card
473,i don t know how i feel about my submissive learning how to use a firearm,i don t know why to feel bad about just my submissive learning how to use a firearm
474,i feel i m being nutritionally supportive of it as well,i feel like m being incredibly nutritionally supportive of it as well.
475,i was feeling particularly vulnerable in a specific area so i began to talking to my friends and interestingly enough there was an incredible understanding of my struggle,i was feeling particularly emotionally uneasy in a large area so i began to talking to my friends and interestingly surprising enough there was an incredible understanding of my struggle
476,i have some great friends and great housemates who have listened to how i feel and reminded me that its so unimportant and i should enjoy my life and be proud of myself,i have some great friends and great housemates who have listened to how good i feel everyday and reminded me that its so unimportant and i should enjoy my life and be proud of myself
477,ive been feeling very mad at it,=e been feeling very fucking mad directed at him
478,i was cooking my dinner feeling pretty melancholy when zane lowe gave it the first spin on his radio one show on tuesday and the song matched my mood perfectly,i was cooking my dinner feeling pretty bad crying herself when zane lowe gave it the first spin on his radio one show on wednesday and the song matched my mood perfectly
479,im feeling and if ive liked being pregnant,im feeling and if ive really liked herself getting pregnant
480,i feel numb i dont experience anything because of the numbness and of me just always feels something is going to go wrong,i feel numb i dont experience anything because of the numbness and of me just always feels sure something good is going to go wrong
481,i have strong feelings about being faithful,i have strong negative feelings about her being loyal
482,i like the fresh feeling of sweet he gave me,i do feeling the fresh feeling of pure sweet he gave me
483,im not feeling anything suspicious really,y im not feel yourself anything fearful.
484,im still feeling a little groggy from the lack of sleep so i shall try to replenish it,im still feeling a sore little extra groggy from the lack of sleep so i shall try to replenish myself
485,i only do unwillingly and always leaves me feeling grouchy and unsettled,i only do unwillingly and always leave me feeling grouchy inside and mentally unsettled
486,i feel like such a noob when the customers make really dull and stupid jokes that im supposed to find funny,i feel like such pathetic a pathetic noob when the customers make really dull and stupid jokes that us supposed to find funny
487,i feel so lucky that i get to experience this joy at sssas every day,i feel so perfectly lucky that i get to experience this wonderful joy at sssas every day
488,i wasnt feeling sociable i really wasnt,i wasnt feeling sociable i just really just wasnt
489,i feel so totally invigorated that i completely forget what it s like to have a cold,her feel so totally invigorated that i completely forget what it is like to go have a big cold
490,i feel more optimistic about everything than i have in a long time,i feel feeling more feeling optimistic about everything than i have in a long time
491,i check you when you re sleeping feel your nose and toes to be sure you aren t too hot or cold,i check you when you re sleeping feel your nose clean and toes clean to be sure you aren t too hot or too
492,i still feel confused and guilty about the whole thing,i still feel feeling uncertain about and desperate about the whole thing
493,i feel rotten remind me that your fruit won t spoil,i feel very rotten remind me that your precious fruit won t spoil
494,im now on day two of the plan and im feeling positive,im now on day two of the plan and im am feeling a positive
495,i feel so fucking worthless,i always feel so fucking absolutely worthless
496,i have nostalgic feelings i have met wonderful people online and the online internet is for me like my second life,i have nostalgic and feelings i have met wonderful good people online and the online internet is for me like my good life
497,i sit up and i feel awful about it as miles starts feeling up whoever s pants under his back for a cigarette box,i sit down and i feel terrible about it as miles starts busy feeling up whoever s pants under his back for a clean cigarette box
498,i feel if i am nagged i stop caring,if i just feel if i am na instructed to stop caring
499,i didn t feel pressured or constrained in my choices to behave in a particular way i just felt very busy,i didn not feel as pressured or constrained in my initial choices to behave in a particular way i just felt very strange
